{
  "$schema_note": "Capability matrix for visual-prompt-forge adapters. Generator models churn monthly. When you re-verify an adapter, bump its model_version and last_verified date here, then reconcile the prose adapter file. This file is the single source of truth for 'what each generator can do'; the .md files are the how-to-prompt guidance. max_prompt_words is a ceiling, not a target: an adapter .md may recommend a narrower range, but it may never advertise more than the ceiling. tools/validate_capabilities.py enforces that relationship and checks that each .md documents the aspect_param named here.",
  "version": "1.1",
  "matrix_last_reviewed": "2026-09-26",
  "generators": [
    {
      "id": "midjourney",
      "display_name": "Midjourney",
      "model_version": "v7",
      "last_verified": "2026-05-08",
      "prompt_style": "keyword",
      "max_prompt_words": 100,
      "supports_text_render": false,
      "supports_motion": false,
      "supports_character_ref": true,
      "supports_style_ref": true,
      "supports_negative_prompt": true,
      "aspect_param": "--ar",
      "api_access": "limited",
      "notes": "Short high-signal phrases. 100 words is the ceiling, past which signal drops off; the adapter recommends 40 to 80. --cref/--sref for series consistency."
    },
    {
      "id": "flux",
      "display_name": "Flux",
      "model_version": "2 Pro",
      "last_verified": "2026-05-08",
      "prompt_style": "natural",
      "max_prompt_words": 150,
      "supports_text_render": true,
      "supports_motion": false,
      "supports_character_ref": true,
      "supports_style_ref": false,
      "supports_negative_prompt": false,
      "aspect_param": "aspect_ratio",
      "api_access": "full",
      "notes": "Natural-language descriptive. Stronger text rendering than MJ but still treat on-screen copy as a separate compositing pass."
    },
    {
      "id": "ideogram",
      "display_name": "Ideogram",
      "model_version": "v3",
      "last_verified": "2026-05-08",
      "prompt_style": "natural",
      "max_prompt_words": 120,
      "supports_text_render": true,
      "supports_motion": false,
      "supports_character_ref": false,
      "supports_style_ref": true,
      "supports_negative_prompt": true,
      "aspect_param": "aspect_ratio",
      "api_access": "full",
      "notes": "Best in-class text rendering. The exception case: if a shot truly needs baked text, Ideogram is the fallback. Default is still composite-after."
    },
    {
      "id": "gpt-image",
      "display_name": "GPT Image",
      "model_version": "1.5/2",
      "last_verified": "2026-05-08",
      "prompt_style": "paragraph",
      "max_prompt_words": 300,
      "supports_text_render": true,
      "supports_motion": false,
      "supports_character_ref": true,
      "supports_style_ref": false,
      "supports_negative_prompt": false,
      "aspect_param": "size",
      "api_access": "full",
      "notes": "Paragraph-form, instruction-following. Tolerates the most context. Good for complex compositions described in sentences."
    },
    {
      "id": "nano-banana",
      "display_name": "Nano Banana 2 (Gemini Flash Image)",
      "model_version": "Gemini 3.1 Flash Image",
      "last_verified": "2026-09-26",
      "prompt_style": "natural",
      "max_prompt_words": 160,
      "supports_text_render": true,
      "supports_motion": false,
      "supports_character_ref": true,
      "supports_style_ref": true,
      "supports_negative_prompt": false,
      "aspect_param": "aspectRatio",
      "api_access": "full",
      "notes": "Fast, cheap, strong editing/consistency via reference images. Good for high-volume iteration. Parameter name is camelCase here, unlike the fal.ai models; it ignores --ar. The ceiling is 160 so the four verbatim series_lock anchors, about 60 words, leave room for the shot. Model id gemini-3.1-flash-image, verified against the Gemini API docs on 2026-09-26."
    },
    {
      "id": "seedream",
      "display_name": "Seedream",
      "model_version": "4.5",
      "last_verified": "2026-05-08",
      "prompt_style": "natural",
      "max_prompt_words": 120,
      "supports_text_render": true,
      "supports_motion": false,
      "supports_character_ref": true,
      "supports_style_ref": true,
      "supports_negative_prompt": true,
      "aspect_param": "aspect_ratio",
      "api_access": "full",
      "notes": "Strong photoreal and bilingual text. Competitive on character consistency."
    },
    {
      "id": "kling",
      "display_name": "Kling 3.0",
      "model_version": "3.0",
      "last_verified": "2026-06-18",
      "prompt_style": "natural",
      "max_prompt_words": 150,
      "supports_text_render": false,
      "supports_motion": true,
      "supports_character_ref": true,
      "supports_style_ref": false,
      "supports_negative_prompt": true,
      "aspect_param": "aspect_ratio",
      "api_access": "full",
      "notes": "Default motion model. Best camera-motion realism per dollar on fal.ai, strongest image-to-video (start/tail frame). 5s or 10s. Reach for this first; escalate only for what it cannot do."
    },
    {
      "id": "veo",
      "display_name": "Veo 3",
      "model_version": "3",
      "last_verified": "2026-06-18",
      "prompt_style": "natural",
      "max_prompt_words": 150,
      "supports_text_render": false,
      "supports_motion": true,
      "supports_character_ref": true,
      "supports_style_ref": false,
      "supports_negative_prompt": false,
      "aspect_param": "aspect_ratio",
      "api_access": "full",
      "notes": "Dialogue and lipsync. Only adapter that generates synchronised native audio in the same pass. Strongest prompt adherence and physics; highest cost. ~8s. Spoken lines go in the prompt; on-screen text still does not."
    },
    {
      "id": "seedance",
      "display_name": "Seedance 2.0",
      "model_version": "2.0",
      "last_verified": "2026-06-18",
      "prompt_style": "natural",
      "max_prompt_words": 150,
      "supports_text_render": false,
      "supports_motion": true,
      "supports_character_ref": true,
      "supports_style_ref": false,
      "supports_negative_prompt": false,
      "aspect_param": "aspect_ratio",
      "api_access": "full",
      "notes": "Multi-shot sequences in a single generation with subject consistency across cuts. Use when consecutive beats share one subject and should feel like one take. Up to ~4 cuts per generation."
    },
    {
      "id": "hailuo",
      "display_name": "Hailuo 02 Pro",
      "model_version": "02 Pro",
      "last_verified": "2026-06-18",
      "prompt_style": "natural",
      "max_prompt_words": 120,
      "supports_text_render": false,
      "supports_motion": true,
      "supports_character_ref": true,
      "supports_style_ref": false,
      "supports_negative_prompt": false,
      "aspect_param": "aspect_ratio",
      "api_access": "full",
      "notes": "Budget, fast iteration. Use to block out camera move, framing, and timing across cheap drafts, then re-roll the keeper on Kling, Veo, or Seedance. Draft tier, not finals."
    }
  ]
}
